{
  "paper_id": "E1",
  "github": "PeterPonyu/free-repetition-band",
  "zenodo_concept_doi": "10.5281/zenodo.21020378",
  "pipeline": "papers/figs/PIPELINE.md",
  "figures": [
    {
      "id": "E1_landscape",
      "label": "fig:landscape",
      "generator": "figs/make_E1_landscape.py",
      "summary": null,
      "preview_svg": null,
      "tex_build": "figs/tex/E1_landscape.tex",
      "vec_build": "figs/vec/E1_landscape.pdf",
      "venue_flat_name": "Figure1.pdf"
    },
    {
      "id": "E1_scheme",
      "label": "fig:scheme",
      "generator": "paper/GENERATORS.md#scheme",
      "summary": null,
      "preview_svg": null,
      "tex_build": "figs/tex/E1_scheme.tex",
      "vec_build": "figs/vec/E1_scheme.pdf",
      "venue_flat_name": "Figure2.pdf"
    },
    {
      "id": "E1_repeat",
      "label": "fig:repeat",
      "generator": "figs/make_E1_figs_r.R",
      "summary": "summaries/E1_repeat.json",
      "preview_svg": null,
      "tex_build": "figs/tex/E1_repeat.tex",
      "vec_build": "figs/vec/E1_repeat.pdf",
      "venue_flat_name": "Figure3.pdf"
    },
    {
      "id": "E1_large_completion",
      "label": "fig:large-completion",
      "generator": "figs/make_E1_new_figs_r.R",
      "summary": "summaries/E1_large_completion.json",
      "preview_svg": null,
      "tex_build": "figs/tex/E1_large_completion.tex",
      "vec_build": "figs/vec/E1_large_completion.pdf",
      "venue_flat_name": "Figure4.pdf"
    },
    {
      "id": "E1_capxl",
      "label": "fig:capxl",
      "generator": "figs/make_E1_new_figs_r.R",
      "summary": "summaries/E1_capxl.json",
      "preview_svg": null,
      "tex_build": "figs/tex/E1_capxl.tex",
      "vec_build": "figs/vec/E1_capxl.pdf",
      "venue_flat_name": "Figure5.pdf"
    },
    {
      "id": "E1_grid",
      "label": "fig:grid",
      "generator": "figs/make_E1_figs_r.R",
      "summary": "summaries/E1_grid.json",
      "preview_svg": null,
      "tex_build": "figs/tex/E1_grid.tex",
      "vec_build": "figs/vec/E1_grid.pdf",
      "venue_flat_name": "Figure6.pdf"
    },
    {
      "id": "E1_scale",
      "label": "fig:e1scale",
      "generator": "figs/make_E1_figs_r.R",
      "summary": "summaries/E1_scale.json",
      "preview_svg": null,
      "tex_build": "figs/tex/E1_scale.tex",
      "vec_build": "figs/vec/E1_scale.pdf",
      "venue_flat_name": "Figure7.pdf"
    },
    {
      "id": "E1_scale_band",
      "label": "fig:scale-band",
      "generator": "figs/make_E1_new_figs_r.R",
      "summary": "summaries/E1_scale_band.json",
      "preview_svg": "previews/E1_scale_band.svg",
      "tex_build": "figs/tex/E1_scale_band.tex",
      "vec_build": "figs/vec/E1_scale_band.pdf",
      "venue_flat_name": "Figure8.pdf"
    },
    {
      "id": "E1_capacity_bridge",
      "label": "fig:capacity-bridge",
      "generator": "figs/make_evidence_figures_r.R",
      "summary": "summaries/E1_capacity_bridge.json",
      "preview_svg": null,
      "tex_build": "figs/tex/E1_capacity_bridge.tex",
      "vec_build": "figs/vec/E1_capacity_bridge.pdf",
      "venue_flat_name": "Figure10.pdf"
    },
    {
      "id": "E1_case",
      "label": "fig:case",
      "generator": "figs/make_E1_figs_r.R",
      "summary": "summaries/E1_case.json",
      "preview_svg": null,
      "tex_build": "figs/tex/E1_case.tex",
      "vec_build": "figs/vec/E1_case.pdf",
      "venue_flat_name": "Figure11.pdf"
    },
    {
      "id": "E1_within_run",
      "label": "fig:within-run",
      "generator": "figs/make_E1_new_figs_r.R",
      "summary": "summaries/E1_within_run.json",
      "preview_svg": null,
      "tex_build": "figs/tex/E1_within_run.tex",
      "vec_build": "figs/vec/E1_within_run.pdf",
      "venue_flat_name": "Figure12.pdf"
    },
    {
      "id": "E1_exposure_control",
      "label": "fig:exposure-control",
      "generator": "figs/make_E1_exposure_control_r.R",
      "summary": "summaries/E1_exposure_control.json",
      "preview_svg": null,
      "tex_build": "figs/tex/E1_exposure_control.tex",
      "vec_build": "figs/vec/E1_exposure_control.pdf",
      "venue_flat_name": null
    }
  ]
}
